<?xml version="1.0"?>
<xs:schema xmlns:xs="http://www.w3.org/2001/XMLSchema" attributeFormDefault="unqualified"
           elementFormDefault="qualified">
    <xs:element name="component">
        <xs:complexType>
            <xs:simpleContent>
                <xs:extension base="xs:string">
                    <xs:attribute type="xs:short" name="amount" use="optional"/>
                    <xs:attribute type="xs:string" name="unit" use="optional"/>
                </xs:extension>
            </xs:simpleContent>
        </xs:complexType>
    </xs:element>
    <xs:element name="model">
        <xs:complexType>
            <xs:sequence>
                <xs:element ref="component" maxOccurs="unbounded" minOccurs="0"/>
            </xs:sequence>
            <xs:attribute type="xs:string" name="name" use="optional"/>
            <xs:attribute type="xs:string" name="isRedundable" use="optional"/>
        </xs:complexType>
    </xs:element>
    <xs:element name="plc_type">
        <xs:complexType>
            <xs:sequence>
                <xs:element ref="model" maxOccurs="unbounded" minOccurs="0"/>
            </xs:sequence>
            <xs:attribute type="xs:string" name="name" use="optional"/>
        </xs:complexType>
    </xs:element>
    <xs:element name="Plcs">
        <xs:complexType>
            <xs:sequence>
                <xs:element ref="plc_type" maxOccurs="unbounded" minOccurs="0"/>
            </xs:sequence>
        </xs:complexType>
    </xs:element>
</xs:schema>
